No,Teks Asli,Lowercase,Tokenisasi,Stopword Removed,Stemming,Plain Text
1,apa saja cara berbeda untuk memasukkan data ke dalam program?,apa saja cara berbeda untuk memasukkan data ke dalam program ,"['apa', 'saja', 'cara', 'berbeda', 'untuk', 'memasukkan', 'data', 'ke', 'dalam', 'program']","['berbeda', 'memasukkan', 'data', 'program']","['beda', 'masuk', 'data', 'program']",beda masuk data program
2,Bisakah Anda ceritakan tentang dasar-dasar pembuatan pohon pencarian biner?,bisakah anda ceritakan tentang dasar dasar pembuatan pohon pencarian biner ,"['bisakah', 'anda', 'ceritakan', 'tentang', 'dasar', 'dasar', 'pembuatan', 'pohon', 'pencarian', 'biner']","['ceritakan', 'dasar', 'dasar', 'pembuatan', 'pohon', 'pencarian', 'biner']","['cerita', 'dasar', 'dasar', 'buat', 'pohon', 'cari', 'biner']",cerita dasar dasar buat pohon cari biner
3,bagaimana cara memulai pengembangan android?,bagaimana cara memulai pengembangan android ,"['bagaimana', 'cara', 'memulai', 'pengembangan', 'android']","['pengembangan', 'android']","['kembang', 'android']",kembang android
4,Apa yang harus saya pelajari selanjutnya setelah belajar tentang jaringan dan komputer?,apa yang harus saya pelajari selanjutnya setelah belajar tentang jaringan dan komputer ,"['apa', 'yang', 'harus', 'saya', 'pelajari', 'selanjutnya', 'setelah', 'belajar', 'tentang', 'jaringan', 'dan', 'komputer']","['pelajari', 'belajar', 'jaringan', 'komputer']","['ajar', 'ajar', 'jaring', 'komputer']",ajar ajar jaring komputer
5,Apa konsep dasar pemrograman komputer?,apa konsep dasar pemrograman komputer ,"['apa', 'konsep', 'dasar', 'pemrograman', 'komputer']","['konsep', 'dasar', 'pemrograman', 'komputer']","['konsep', 'dasar', 'pemrograman', 'komputer']",konsep dasar pemrograman komputer
